citation,book,chapter,verse,text
2 Timothy 1:12,2 Timothy,1,12,"""For the which cause I also suffer these things: nevertheless I am not ashamed: for I know whom I have believed, and am persuaded that he is able to keep that which I have committed unto him against that day."""
Psalms 23:4,Psalms,23,4,"""Yea, though I walk through the valley of the shadow of death, I will fear no evil: for thou art with me; thy rod and thy staff they comfort me."""
Acts 2:38,Acts,2,38,"""Then Peter said unto them, Repent, and be baptized every one of you in the name of Jesus Christ for the remission of sins, and ye shall receive the gift of the Holy Ghost."""
Job 12:9,Job,12,9,"""Who knoweth not in all these that the hand of the LORD hath wrought this?"""
2 Timothy 3:16-17,2 Timothy,3,16,"""All scripture is given by inspiration of God, and is profitable for doctrine, for reproof, for correction, for instruction in righteousness: That the man of God may be perfect, throughly furnished unto all good works."""
Genesis 8:22,Genesis,8,22,"""While the earth remaineth, seedtime and harvest, and cold and heat, and summer and winter, and day and night shall not cease."""
John 1:3,John,1,3,"""All things were made by him; and without him was not any thing made that was made."""
Proverbs 13:11,Proverbs,13,11,"""Wealth gotten by vanity shall be diminished: but he that gathereth by labour shall increase."""
Romans 12:2,Romans,12,2,"""And be not conformed to this world: but be ye transformed by the renewing of your mind, that ye may prove what is that good, and acceptable, and perfect, will of God."""
Proverbs 3:5,Proverbs,3,5,"""Trust in the LORD with all thine heart; and lean not unto thine own understanding."""
Revelation 21:4,Revelation,21,4,"""And God shall wipe away all tears from their eyes; and there shall be no more death, neither sorrow, nor crying, neither shall there be any more pain: for the former things are passed away."""
Psalms 62:1,Psalms,62,1,"""Truly my soul waiteth upon God: from him cometh my salvation. He only is my rock and my salvation; he is my defence; I shall not be greatly moved."""
2 Corinthians 12:9,2 Corinthians,12,9,"""And he said unto me, My grace is sufficient for thee: for my strength is made perfect in weakness. Most gladly therefore will I rather glory in my infirmities, that the power of Christ may rest upon me."""
Proverbs 22:6,Proverbs,22,6,"""Train up a child in the way he should go: and when he is old, he will not depart from it."""
Matthew 28:18,Matthew,28,18,"""And Jesus came and spake unto them, saying, All power is given unto me in heaven and in earth."""
Ecclesiastes 3:1-8,Ecclesiastes,3,1,"""To every thing there is a season, and a time to every purpose under the heaven: A time to be born, and a time to die; a time to plant, and a time to pluck up that which is planted; A time to kill, and a time to heal; a time to break down, and a time to build up; A time to weep, and a time to laugh; a time to mourn, and a time to dance; A time to cast away stones, and a time to gather stones together; a time to embrace, and a time to refrain from embracing; A time to get, and a time to lose; a time to keep, and a time to cast away; A time to rend, and a time to sew; a time to keep silence, and a time to speak; A time to love, and a time to hate; a time of war, and a time of peace."""
Galatians 6:9,Galatians,6,9,"""And let us not be weary in well doing: for in due season we shall reap, if we faint not."""
Psalms 119:90,Psalms,119,90,"""Thy faithfulness is unto all generations: thou hast established the earth, and it abideth."""
1 Corinthians 13:13,1 Corinthians,13,13,"""And now abideth faith, hope, charity, these three; but the greatest of these is charity."""
Psalms 16:11,Psalms,16,11,"""Thou wilt shew me the path of life: in thy presence is fulness of joy; at thy right hand there are pleasures for evermore."""
Matthew 18:3,Matthew,18,3,"""And said, Verily I say unto you, Except ye be converted, and become as little children, ye shall not enter into the kingdom of heaven."""
Isaiah 26:3,Isaiah,26,3,"""Thou wilt keep him in perfect peace, whose mind is stayed on thee: because he trusteth in thee."""
Philippians 4:7,Philippians,4,7,"""And the peace of God, which passeth all understanding, shall keep your hearts and minds through Christ Jesus."""
Ephesians 5:2,Ephesians,5,2,"""And walk in love, as Christ also hath loved us, and hath given himself for us an offering and a sacrifice to God for a sweetsmelling savour."""
Psalms 118:24,Psalms,118,24,"""This is the day which the LORD hath made; we will rejoice and be glad in it."""
Romans 8:28,Romans,8,28,"""And we know that all things work together for good to them that love God, to them who are the called according to his purpose."""
Joshua 1:8,Joshua,1,8,"""This book of the law shall not depart out of thy mouth; but thou shalt meditate therein day and night, that thou mayest observe to do according to all that is written therein: for then thou shalt make thy way prosperous, and then thou shalt have good success."""
Colossians 3:23,Colossians,3,23,"""And whatsoever ye do, do it heartily, as to the Lord, and not unto men;"""
Matthew 7:7-8,Matthew,7,7,"""Ask, and it shall be given you; seek, and ye shall find; knock, and it shall be opened unto you: For every one that asketh receiveth; and he that seeketh findeth; and to him that knocketh it shall be opened."""
Proverbs 18:10,Proverbs,18,10,"""The name of the LORD is a strong tower: the righteous runneth into it, and is safe."""
Philippians 4:6,Philippians,4,6,"""Be careful for nothing; but in every thing by prayer and supplication with thanksgiving let your requests be made known unto God."""
Psalms 23:1,Psalms,23,1,"""The LORD is my shepherd; I shall not want."""
1 Peter 5:8-9,1 Peter,5,8,"""Be sober, be vigilant; because your adversary the devil, as a roaring lion, walketh about, seeking whom he may devour: Whom resist stedfast in the faith, knowing that the same afflictions are accomplished in your brethren that are in the world."""
Psalms 7:8,Psalms,7,8,"""The LORD shall judge the people: judge me, O LORD, according to my righteousness, and according to mine integrity that is in me."""
Philippians 1:6-7,Philippians,1,6,"""Being confident of this very thing, that he which hath begun a good work in you will perform it until the day of Jesus Christ: Even as it is meet for me to think this of you all, because I have you in my heart; inasmuch as both in my bonds, and in the defence and confirmation of the gospel, ye all are partakers of my grace."""
Nahum 1:7,Nahum,1,7,"""The LORD is good, a strong hold in the day of trouble; and he knoweth them that trust in him."""
Romans 12:14,Romans,12,14,"""Bless them which persecute you: bless, and curse not."""
James 1:12,James,1,12,"""Blessed is the man that endureth temptation: for when he is tried, he shall receive the crown of life, which the Lord hath promised to them that love him."""
Psalms 19:1,Psalms,19,1,"""The heavens declare the glory of God; and the firmament sheweth his handywork."""
1 Corinthians 2:9,1 Corinthians,2,9,"""But as it is written, Eye hath not seen, nor ear heard, neither have entered into the heart of man, the things which God hath prepared for them that love him."""
Psalms 83:18,Psalms,83,18,"""That men may know that thou, whose name alone is JEHOVAH, art the most high over all the earth."""
John 1:12-13,John,1,12,"""But as many as received him, to them gave he power to become the sons of God, even to them that believe on his name: Which were born, not of blood, nor of the will of the flesh, nor of the will of man, but of God."""
Isaiah 53:4,Isaiah,53,4,"""Surely he hath borne our griefs, and carried our sorrows: yet we did esteem him stricken, smitten of God, and afflicted."""
Romans 5:8,Romans,5,8,"""But God commendeth his love toward us, in that, while we were yet sinners, Christ died for us."""
Genesis 1:27,Genesis,1,27,"""So God created man in his own image, in the image of God created he him; male and female created he them."""
Matthew 5:44-45,Matthew,5,44,"""But I say unto you, Love your enemies, bless them that curse you, do good to them that hate you, and pray for them which despitefully use you, and persecute you; That ye may be the children of your Father which is in heaven: for he maketh his sun to rise on the evil and on the good, and sendeth rain on the just and on the unjust."""
Matthew 6:20-21,Matthew,6,20,"""But lay up for yourselves treasures in heaven, where neither moth nor rust doth corrupt, and where thieves do not break through nor steal: For where your treasure is, there will your heart be also."""
